{
  "contract_version": 3,
  "suite": "optimistic_state",
  "case_id": "derive_conflict_rolls_back_to_server",
  "operation": "derive",
  "input": {
    "snapshot": {
      "is_in_watchlist": false,
      "is_watched": true,
      "liked": true,
      "episode_watched": {},
      "season_watched": {}
    },
    "mutations": [
      {
        "kind": "watchlist",
        "id": "m1",
        "entity_id": "tt123",
        "created_at_ms": 1000,
        "attempt": 2,
        "status": "conflict",
        "status_server_value": "false",
        "desired": true
      },
      {
        "kind": "rating",
        "id": "m2",
        "entity_id": "tt123",
        "created_at_ms": 1100,
        "attempt": 1,
        "status": "failed",
        "status_reason": "Network unavailable.",
        "desired": false
      }
    ]
  },
  "expected": {
    "watchlist": {
      "value": false,
      "sync": "error"
    },
    "title_watched": {
      "value": true,
      "sync": "idle"
    },
    "rating": {
      "value": true,
      "sync": "error"
    },
    "episode_watched": {},
    "season_watched": {}
  }
}
