{
  "contract_version": 3,
  "suite": "optimistic_state",
  "case_id": "derive_rating_clear_vote",
  "operation": "derive",
  "input": {
    "snapshot": {
      "is_in_watchlist": false,
      "is_watched": false,
      "liked": false,
      "episode_watched": {},
      "season_watched": {}
    },
    "mutations": [
      {
        "kind": "rating",
        "id": "m1",
        "entity_id": "tt123",
        "created_at_ms": 1000,
        "attempt": 0,
        "status": "pending",
        "desired": null
      }
    ]
  },
  "expected": {
    "watchlist": {
      "value": false,
      "sync": "idle"
    },
    "title_watched": {
      "value": false,
      "sync": "idle"
    },
    "rating": {
      "value": null,
      "sync": "syncing"
    },
    "episode_watched": {},
    "season_watched": {}
  }
}